{
  "$schema": "http://json-schema.org/draft-07/schema#",
  "title": "PokemonTCGPCard",
  "description": "A single card entry in the Pokemon TCG Pocket collection database.",
  "type": "object",
  "required": [
    "id",
    "card_name",
    "quantity",
    "card_category",
    "pokemon_type",
    "stage",
    "hp",
    "is_ex",
    "special_type",
    "rarity",
    "set_or_pack",
    "variant_notes",
    "source_screenshot",
    "source_row",
    "source_column",
    "confidence",
    "needs_review",
    "review_reason"
  ],
  "properties": {
    "id": {
      "type": "string",
      "description": "Stable deterministic ID: normalized_card_name_special_type_set_or_pack_vN",
      "pattern": "^[a-z0-9_]+_v[0-9]+$"
    },
    "card_name": {
      "type": "string",
      "description": "Card name as shown in the app. Use 'unknown' if unreadable."
    },
    "quantity": {
      "type": "integer",
      "minimum": 0,
      "description": "Number of copies owned, as shown in the app grid."
    },
    "card_category": {
      "type": "string",
      "enum": ["Pokemon", "Trainer", "Item", "Supporter", "Tool", "Stadium", "Fossil", "Unknown"],
      "description": "Top-level card category."
    },
    "pokemon_type": {
      "type": "string",
      "enum": ["Grass", "Fire", "Water", "Lightning", "Psychic", "Fighting", "Darkness", "Metal", "Dragon", "Colorless", "None", "Unknown"],
      "description": "Pokemon energy type. Use None for Trainer cards."
    },
    "stage": {
      "type": "string",
      "enum": ["Basic", "Stage 1", "Stage 2", "None", "Unknown"],
      "description": "Evolution stage. Use None for non-Pokemon cards."
    },
    "hp": {
      "type": ["integer", "null"],
      "minimum": 0,
      "description": "HP value if visible and applicable, otherwise null."
    },
    "is_ex": {
      "type": "boolean",
      "description": "True if this is an ex card."
    },
    "special_type": {
      "type": "string",
      "enum": [
        "normal",
        "full_art",
        "illustration_rare",
        "special_art",
        "immersive",
        "crown_gold",
        "shiny",
        "rainbow",
        "promo",
        "special_trainer",
        "alternate_art",
        "unknown"
      ],
      "description": "Visual variant / treatment category."
    },
    "rarity": {
      "type": "string",
      "description": "Rarity symbol or label as visible on the card. Use 'unknown' if not visible."
    },
    "set_or_pack": {
      "type": "string",
      "description": "Set or pack name if visible. Use 'unknown' if not visible."
    },
    "variant_notes": {
      "type": "string",
      "description": "Free-text notes distinguishing this card from same-name variants."
    },
    "source_screenshot": {
      "type": "string",
      "description": "Filename of the screenshot this card was extracted from."
    },
    "source_row": {
      "type": ["integer", "null"],
      "minimum": 1,
      "description": "Row position in the app grid (1-indexed). Null if unknown."
    },
    "source_column": {
      "type": ["integer", "null"],
      "minimum": 1,
      "description": "Column position in the app grid (1-indexed). Null if unknown."
    },
    "confidence": {
      "type": "string",
      "enum": ["high", "medium", "low"],
      "description": "Extraction confidence level."
    },
    "needs_review": {
      "type": "boolean",
      "description": "True if this card requires human review before the database is considered final."
    },
    "review_reason": {
      "type": "string",
      "description": "Required non-empty explanation when needs_review is true."
    }
  },
  "additionalProperties": false
}
