[
  {
    "id": "aromatisse_unknown_unknown_v1",
    "card_name": "Aromatisse",
    "quantity": 2,
    "card_category": "Unknown",
    "pokemon_type": "Unknown",
    "stage": "Unknown",
    "hp": null,
    "is_ex": false,
    "special_type": "unknown",
    "rarity": "unknown",
    "set_or_pack": "unknown",
    "variant_notes": "",
    "source_screenshot": "IMG_1539.PNG",
    "source_row": 1,
    "source_column": 1,
    "confidence": "medium",
    "needs_review": true,
    "review_reason": "special_type not confirmed; visual review needed"
  },
  {
    "id": "onix_unknown_unknown_v1",
    "card_name": "Onix",
    "quantity": 2,
    "card_category": "Unknown",
    "pokemon_type": "Unknown",
    "stage": "Unknown",
    "hp": null,
    "is_ex": false,
    "special_type": "unknown",
    "rarity": "unknown",
    "set_or_pack": "unknown",
    "variant_notes": "",
    "source_screenshot": "IMG_1539.PNG",
    "source_row": 1,
    "source_column": 2,
    "confidence": "medium",
    "needs_review": true,
    "review_reason": "special_type not confirmed; visual review needed"
  },
  {
    "id": "makuhita_unknown_unknown_v1",
    "card_name": "Makuhita",
    "quantity": 1,
    "card_category": "Unknown",
    "pokemon_type": "Unknown",
    "stage": "Unknown",
    "hp": null,
    "is_ex": false,
    "special_type": "unknown",
    "rarity": "unknown",
    "set_or_pack": "unknown",
    "variant_notes": "",
    "source_screenshot": "IMG_1539.PNG",
    "source_row": 1,
    "source_column": 3,
    "confidence": "medium",
    "needs_review": true,
    "review_reason": "special_type not confirmed; visual review needed"
  },
  {
    "id": "nosepass_unknown_unknown_v1",
    "card_name": "Nosepass",
    "quantity": 6,
    "card_category": "Unknown",
    "pokemon_type": "Unknown",
    "stage": "Unknown",
    "hp": null,
    "is_ex": false,
    "special_type": "unknown",
    "rarity": "unknown",
    "set_or_pack": "unknown",
    "variant_notes": "autofill verified",
    "source_screenshot": "IMG_1539.PNG",
    "source_row": 2,
    "source_column": 1,
    "confidence": "medium",
    "needs_review": true,
    "review_reason": "special_type not confirmed; visual review needed"
  },
  {
    "id": "mienfoo_unknown_unknown_v1",
    "card_name": "Mienfoo",
    "quantity": 1,
    "card_category": "Unknown",
    "pokemon_type": "Unknown",
    "stage": "Unknown",
    "hp": null,
    "is_ex": false,
    "special_type": "unknown",
    "rarity": "unknown",
    "set_or_pack": "unknown",
    "variant_notes": "",
    "source_screenshot": "IMG_1539.PNG",
    "source_row": 2,
    "source_column": 2,
    "confidence": "medium",
    "needs_review": true,
    "review_reason": "special_type not confirmed; visual review needed"
  },
  {
    "id": "mienshao_unknown_unknown_v1",
    "card_name": "Mienshao",
    "quantity": 2,
    "card_category": "Unknown",
    "pokemon_type": "Unknown",
    "stage": "Unknown",
    "hp": null,
    "is_ex": false,
    "special_type": "unknown",
    "rarity": "unknown",
    "set_or_pack": "unknown",
    "variant_notes": "",
    "source_screenshot": "IMG_1539.PNG",
    "source_row": 2,
    "source_column": 3,
    "confidence": "medium",
    "needs_review": true,
    "review_reason": "special_type not confirmed; visual review needed"
  },
  {
    "id": "grimer_unknown_unknown_v1",
    "card_name": "Grimer",
    "quantity": 3,
    "card_category": "Unknown",
    "pokemon_type": "Unknown",
    "stage": "Unknown",
    "hp": null,
    "is_ex": false,
    "special_type": "unknown",
    "rarity": "unknown",
    "set_or_pack": "unknown",
    "variant_notes": "",
    "source_screenshot": "IMG_1539.PNG",
    "source_row": 3,
    "source_column": 1,
    "confidence": "medium",
    "needs_review": true,
    "review_reason": "special_type not confirmed; visual review needed"
  },
  {
    "id": "trubbish_unknown_unknown_v1",
    "card_name": "Trubbish",
    "quantity": 1,
    "card_category": "Unknown",
    "pokemon_type": "Unknown",
    "stage": "Unknown",
    "hp": null,
    "is_ex": false,
    "special_type": "unknown",
    "rarity": "unknown",
    "set_or_pack": "unknown",
    "variant_notes": "",
    "source_screenshot": "IMG_1539.PNG",
    "source_row": 3,
    "source_column": 2,
    "confidence": "medium",
    "needs_review": true,
    "review_reason": "special_type not confirmed; visual review needed"
  },
  {
    "id": "porygon_unknown_unknown_v1",
    "card_name": "Porygon",
    "quantity": 3,
    "card_category": "Unknown",
    "pokemon_type": "Unknown",
    "stage": "Unknown",
    "hp": null,
    "is_ex": false,
    "special_type": "unknown",
    "rarity": "unknown",
    "set_or_pack": "unknown",
    "variant_notes": "",
    "source_screenshot": "IMG_1539.PNG",
    "source_row": 3,
    "source_column": 3,
    "confidence": "medium",
    "needs_review": true,
    "review_reason": "special_type not confirmed; visual review needed"
  }
]