[
  {
    "id": "morpeko_unknown_unknown_v1",
    "card_name": "Morpeko",
    "quantity": 1,
    "card_category": "Unknown",
    "pokemon_type": "Unknown",
    "stage": "Unknown",
    "hp": null,
    "is_ex": false,
    "special_type": "unknown",
    "rarity": "unknown",
    "set_or_pack": "unknown",
    "variant_notes": "",
    "source_screenshot": "IMG_1525.PNG",
    "source_row": 1,
    "source_column": 1,
    "confidence": "medium",
    "needs_review": true,
    "review_reason": "special_type not confirmed; visual review needed"
  },
  {
    "id": "bonsly_unknown_unknown_v1",
    "card_name": "Bonsly",
    "quantity": 1,
    "card_category": "Unknown",
    "pokemon_type": "Unknown",
    "stage": "Unknown",
    "hp": null,
    "is_ex": false,
    "special_type": "unknown",
    "rarity": "unknown",
    "set_or_pack": "unknown",
    "variant_notes": "",
    "source_screenshot": "IMG_1525.PNG",
    "source_row": 1,
    "source_column": 2,
    "confidence": "medium",
    "needs_review": true,
    "review_reason": "special_type not confirmed; visual review needed"
  },
  {
    "id": "riolu_unknown_unknown_v1",
    "card_name": "Riolu",
    "quantity": 1,
    "card_category": "Unknown",
    "pokemon_type": "Unknown",
    "stage": "Unknown",
    "hp": null,
    "is_ex": false,
    "special_type": "unknown",
    "rarity": "unknown",
    "set_or_pack": "unknown",
    "variant_notes": "",
    "source_screenshot": "IMG_1525.PNG",
    "source_row": 1,
    "source_column": 3,
    "confidence": "medium",
    "needs_review": true,
    "review_reason": "special_type not confirmed; visual review needed"
  },
  {
    "id": "meltan_unknown_unknown_v1",
    "card_name": "Meltan",
    "quantity": 1,
    "card_category": "Unknown",
    "pokemon_type": "Unknown",
    "stage": "Unknown",
    "hp": null,
    "is_ex": false,
    "special_type": "unknown",
    "rarity": "unknown",
    "set_or_pack": "unknown",
    "variant_notes": "",
    "source_screenshot": "IMG_1525.PNG",
    "source_row": 2,
    "source_column": 1,
    "confidence": "medium",
    "needs_review": true,
    "review_reason": "special_type not confirmed; visual review needed"
  },
  {
    "id": "moltres_unknown_unknown_v1",
    "card_name": "Moltres",
    "quantity": 1,
    "card_category": "Unknown",
    "pokemon_type": "Unknown",
    "stage": "Unknown",
    "hp": null,
    "is_ex": true,
    "special_type": "unknown",
    "rarity": "unknown",
    "set_or_pack": "unknown",
    "variant_notes": "",
    "source_screenshot": "IMG_1525.PNG",
    "source_row": 2,
    "source_column": 2,
    "confidence": "medium",
    "needs_review": true,
    "review_reason": "special_type not confirmed; visual review needed"
  },
  {
    "id": "marowak_unknown_unknown_v1",
    "card_name": "Marowak",
    "quantity": 1,
    "card_category": "Unknown",
    "pokemon_type": "Unknown",
    "stage": "Unknown",
    "hp": null,
    "is_ex": true,
    "special_type": "unknown",
    "rarity": "unknown",
    "set_or_pack": "unknown",
    "variant_notes": "",
    "source_screenshot": "IMG_1525.PNG",
    "source_row": 2,
    "source_column": 3,
    "confidence": "medium",
    "needs_review": true,
    "review_reason": "special_type not confirmed; visual review needed"
  },
  {
    "id": "incineroar_unknown_unknown_v1",
    "card_name": "Incineroar",
    "quantity": 1,
    "card_category": "Unknown",
    "pokemon_type": "Unknown",
    "stage": "Unknown",
    "hp": null,
    "is_ex": true,
    "special_type": "unknown",
    "rarity": "unknown",
    "set_or_pack": "unknown",
    "variant_notes": "",
    "source_screenshot": "IMG_1525.PNG",
    "source_row": 3,
    "source_column": 1,
    "confidence": "medium",
    "needs_review": true,
    "review_reason": "special_type not confirmed; visual review needed"
  },
  {
    "id": "mega_venusaur_ex_unknown_unknown_v1",
    "card_name": "Mega Venusaur ex",
    "quantity": 2,
    "card_category": "Unknown",
    "pokemon_type": "Unknown",
    "stage": "Unknown",
    "hp": null,
    "is_ex": true,
    "special_type": "unknown",
    "rarity": "unknown",
    "set_or_pack": "unknown",
    "variant_notes": "MEGA; user wrote Venosaur",
    "source_screenshot": "IMG_1525.PNG",
    "source_row": 3,
    "source_column": 2,
    "confidence": "medium",
    "needs_review": true,
    "review_reason": "special_type not confirmed; visual review needed"
  },
  {
    "id": "mega_charizard_y_ex_unknown_unknown_v1",
    "card_name": "Mega Charizard Y ex",
    "quantity": 2,
    "card_category": "Unknown",
    "pokemon_type": "Unknown",
    "stage": "Unknown",
    "hp": null,
    "is_ex": true,
    "special_type": "unknown",
    "rarity": "unknown",
    "set_or_pack": "unknown",
    "variant_notes": "MEGA Charizard Y EX",
    "source_screenshot": "IMG_1525.PNG",
    "source_row": 3,
    "source_column": 3,
    "confidence": "medium",
    "needs_review": true,
    "review_reason": "special_type not confirmed; visual review needed"
  }
]