[
  {
    "id": "trapinch_unknown_unknown_v1",
    "card_name": "Trapinch",
    "quantity": 1,
    "card_category": "Unknown",
    "pokemon_type": "Unknown",
    "stage": "Unknown",
    "hp": null,
    "is_ex": false,
    "special_type": "unknown",
    "rarity": "unknown",
    "set_or_pack": "unknown",
    "variant_notes": "",
    "source_screenshot": "IMG_1544.PNG",
    "source_row": 1,
    "source_column": 1,
    "confidence": "medium",
    "needs_review": true,
    "review_reason": "special_type not confirmed; visual review needed"
  },
  {
    "id": "riolu_unknown_unknown_v1",
    "card_name": "Riolu",
    "quantity": 2,
    "card_category": "Unknown",
    "pokemon_type": "Unknown",
    "stage": "Unknown",
    "hp": null,
    "is_ex": false,
    "special_type": "unknown",
    "rarity": "unknown",
    "set_or_pack": "unknown",
    "variant_notes": "",
    "source_screenshot": "IMG_1544.PNG",
    "source_row": 1,
    "source_column": 2,
    "confidence": "medium",
    "needs_review": true,
    "review_reason": "special_type not confirmed; visual review needed"
  },
  {
    "id": "croagunk_unknown_unknown_v1",
    "card_name": "Croagunk",
    "quantity": 3,
    "card_category": "Unknown",
    "pokemon_type": "Unknown",
    "stage": "Unknown",
    "hp": null,
    "is_ex": false,
    "special_type": "unknown",
    "rarity": "unknown",
    "set_or_pack": "unknown",
    "variant_notes": "",
    "source_screenshot": "IMG_1544.PNG",
    "source_row": 1,
    "source_column": 3,
    "confidence": "medium",
    "needs_review": true,
    "review_reason": "special_type not confirmed; visual review needed"
  },
  {
    "id": "throh_unknown_unknown_v1",
    "card_name": "Throh",
    "quantity": 1,
    "card_category": "Unknown",
    "pokemon_type": "Unknown",
    "stage": "Unknown",
    "hp": null,
    "is_ex": false,
    "special_type": "unknown",
    "rarity": "unknown",
    "set_or_pack": "unknown",
    "variant_notes": "user wrote Throah",
    "source_screenshot": "IMG_1544.PNG",
    "source_row": 2,
    "source_column": 1,
    "confidence": "medium",
    "needs_review": true,
    "review_reason": "special_type not confirmed; visual review needed"
  },
  {
    "id": "dwebble_unknown_unknown_v1",
    "card_name": "Dwebble",
    "quantity": 1,
    "card_category": "Unknown",
    "pokemon_type": "Unknown",
    "stage": "Unknown",
    "hp": null,
    "is_ex": false,
    "special_type": "unknown",
    "rarity": "unknown",
    "set_or_pack": "unknown",
    "variant_notes": "user wrote Dweeble",
    "source_screenshot": "IMG_1544.PNG",
    "source_row": 2,
    "source_column": 2,
    "confidence": "medium",
    "needs_review": true,
    "review_reason": "special_type not confirmed; visual review needed"
  },
  {
    "id": "stufful_unknown_unknown_v1",
    "card_name": "Stufful",
    "quantity": 1,
    "card_category": "Unknown",
    "pokemon_type": "Unknown",
    "stage": "Unknown",
    "hp": null,
    "is_ex": false,
    "special_type": "unknown",
    "rarity": "unknown",
    "set_or_pack": "unknown",
    "variant_notes": "",
    "source_screenshot": "IMG_1544.PNG",
    "source_row": 2,
    "source_column": 3,
    "confidence": "medium",
    "needs_review": true,
    "review_reason": "special_type not confirmed; visual review needed"
  },
  {
    "id": "rolycoly_unknown_unknown_v1",
    "card_name": "Rolycoly",
    "quantity": 2,
    "card_category": "Unknown",
    "pokemon_type": "Unknown",
    "stage": "Unknown",
    "hp": null,
    "is_ex": false,
    "special_type": "unknown",
    "rarity": "unknown",
    "set_or_pack": "unknown",
    "variant_notes": "",
    "source_screenshot": "IMG_1544.PNG",
    "source_row": 3,
    "source_column": 1,
    "confidence": "medium",
    "needs_review": true,
    "review_reason": "special_type not confirmed; visual review needed"
  },
  {
    "id": "silicobra_unknown_unknown_v1",
    "card_name": "Silicobra",
    "quantity": 2,
    "card_category": "Unknown",
    "pokemon_type": "Unknown",
    "stage": "Unknown",
    "hp": null,
    "is_ex": false,
    "special_type": "unknown",
    "rarity": "unknown",
    "set_or_pack": "unknown",
    "variant_notes": "user wrote Sillicobra",
    "source_screenshot": "IMG_1544.PNG",
    "source_row": 3,
    "source_column": 2,
    "confidence": "medium",
    "needs_review": true,
    "review_reason": "special_type not confirmed; visual review needed"
  },
  {
    "id": "kubfu_unknown_unknown_v1",
    "card_name": "Kubfu",
    "quantity": 1,
    "card_category": "Unknown",
    "pokemon_type": "Unknown",
    "stage": "Unknown",
    "hp": null,
    "is_ex": false,
    "special_type": "unknown",
    "rarity": "unknown",
    "set_or_pack": "unknown",
    "variant_notes": "",
    "source_screenshot": "IMG_1544.PNG",
    "source_row": 3,
    "source_column": 3,
    "confidence": "medium",
    "needs_review": true,
    "review_reason": "special_type not confirmed; visual review needed"
  }
]