[
  {
    "id": "breloom_unknown_unknown_v1",
    "card_name": "Breloom",
    "quantity": 1,
    "card_category": "Unknown",
    "pokemon_type": "Unknown",
    "stage": "Unknown",
    "hp": null,
    "is_ex": false,
    "special_type": "unknown",
    "rarity": "unknown",
    "set_or_pack": "unknown",
    "variant_notes": "",
    "source_screenshot": "IMG_1532.PNG",
    "source_row": 1,
    "source_column": 1,
    "confidence": "medium",
    "needs_review": true,
    "review_reason": "special_type not confirmed; visual review needed"
  },
  {
    "id": "leavanny_unknown_unknown_v1",
    "card_name": "Leavanny",
    "quantity": 1,
    "card_category": "Unknown",
    "pokemon_type": "Unknown",
    "stage": "Unknown",
    "hp": null,
    "is_ex": false,
    "special_type": "unknown",
    "rarity": "unknown",
    "set_or_pack": "unknown",
    "variant_notes": "",
    "source_screenshot": "IMG_1532.PNG",
    "source_row": 1,
    "source_column": 2,
    "confidence": "medium",
    "needs_review": true,
    "review_reason": "special_type not confirmed; visual review needed"
  },
  {
    "id": "pignite_unknown_unknown_v1",
    "card_name": "Pignite",
    "quantity": 3,
    "card_category": "Unknown",
    "pokemon_type": "Unknown",
    "stage": "Unknown",
    "hp": null,
    "is_ex": false,
    "special_type": "unknown",
    "rarity": "unknown",
    "set_or_pack": "unknown",
    "variant_notes": "",
    "source_screenshot": "IMG_1532.PNG",
    "source_row": 1,
    "source_column": 3,
    "confidence": "medium",
    "needs_review": true,
    "review_reason": "special_type not confirmed; visual review needed"
  },
  {
    "id": "darmanitan_unknown_unknown_v1",
    "card_name": "Darmanitan",
    "quantity": 3,
    "card_category": "Unknown",
    "pokemon_type": "Unknown",
    "stage": "Unknown",
    "hp": null,
    "is_ex": false,
    "special_type": "unknown",
    "rarity": "unknown",
    "set_or_pack": "unknown",
    "variant_notes": "",
    "source_screenshot": "IMG_1532.PNG",
    "source_row": 2,
    "source_column": 1,
    "confidence": "medium",
    "needs_review": true,
    "review_reason": "special_type not confirmed; visual review needed"
  },
  {
    "id": "poliwhirl_unknown_unknown_v1",
    "card_name": "Poliwhirl",
    "quantity": 2,
    "card_category": "Unknown",
    "pokemon_type": "Unknown",
    "stage": "Unknown",
    "hp": null,
    "is_ex": false,
    "special_type": "unknown",
    "rarity": "unknown",
    "set_or_pack": "unknown",
    "variant_notes": "",
    "source_screenshot": "IMG_1532.PNG",
    "source_row": 2,
    "source_column": 2,
    "confidence": "medium",
    "needs_review": true,
    "review_reason": "special_type not confirmed; visual review needed"
  },
  {
    "id": "paldean_tauros_unknown_unknown_v1",
    "card_name": "Paldean Tauros",
    "quantity": 2,
    "card_category": "Unknown",
    "pokemon_type": "Unknown",
    "stage": "Unknown",
    "hp": null,
    "is_ex": false,
    "special_type": "unknown",
    "rarity": "unknown",
    "set_or_pack": "unknown",
    "variant_notes": "",
    "source_screenshot": "IMG_1532.PNG",
    "source_row": 2,
    "source_column": 3,
    "confidence": "medium",
    "needs_review": true,
    "review_reason": "special_type not confirmed; visual review needed"
  },
  {
    "id": "quagsire_unknown_unknown_v1",
    "card_name": "Quagsire",
    "quantity": 1,
    "card_category": "Unknown",
    "pokemon_type": "Unknown",
    "stage": "Unknown",
    "hp": null,
    "is_ex": false,
    "special_type": "unknown",
    "rarity": "unknown",
    "set_or_pack": "unknown",
    "variant_notes": "",
    "source_screenshot": "IMG_1532.PNG",
    "source_row": 3,
    "source_column": 1,
    "confidence": "medium",
    "needs_review": true,
    "review_reason": "special_type not confirmed; visual review needed"
  },
  {
    "id": "huntail_unknown_unknown_v1",
    "card_name": "Huntail",
    "quantity": 2,
    "card_category": "Unknown",
    "pokemon_type": "Unknown",
    "stage": "Unknown",
    "hp": null,
    "is_ex": false,
    "special_type": "unknown",
    "rarity": "unknown",
    "set_or_pack": "unknown",
    "variant_notes": "",
    "source_screenshot": "IMG_1532.PNG",
    "source_row": 3,
    "source_column": 2,
    "confidence": "medium",
    "needs_review": true,
    "review_reason": "special_type not confirmed; visual review needed"
  },
  {
    "id": "gorebyss_unknown_unknown_v1",
    "card_name": "Gorebyss",
    "quantity": 1,
    "card_category": "Unknown",
    "pokemon_type": "Unknown",
    "stage": "Unknown",
    "hp": null,
    "is_ex": false,
    "special_type": "unknown",
    "rarity": "unknown",
    "set_or_pack": "unknown",
    "variant_notes": "",
    "source_screenshot": "IMG_1532.PNG",
    "source_row": 3,
    "source_column": 3,
    "confidence": "medium",
    "needs_review": true,
    "review_reason": "special_type not confirmed; visual review needed"
  }
]