[
  {
    "id": "koffing_unknown_unknown_v1",
    "card_name": "Koffing",
    "quantity": 2,
    "card_category": "Unknown",
    "pokemon_type": "Unknown",
    "stage": "Unknown",
    "hp": null,
    "is_ex": false,
    "special_type": "unknown",
    "rarity": "unknown",
    "set_or_pack": "unknown",
    "variant_notes": "",
    "source_screenshot": "IMG_1545.PNG",
    "source_row": 1,
    "source_column": 1,
    "confidence": "medium",
    "needs_review": true,
    "review_reason": "special_type not confirmed; visual review needed"
  },
  {
    "id": "qwilfish_unknown_unknown_v1",
    "card_name": "Qwilfish",
    "quantity": 1,
    "card_category": "Unknown",
    "pokemon_type": "Unknown",
    "stage": "Unknown",
    "hp": null,
    "is_ex": false,
    "special_type": "unknown",
    "rarity": "unknown",
    "set_or_pack": "unknown",
    "variant_notes": "",
    "source_screenshot": "IMG_1545.PNG",
    "source_row": 1,
    "source_column": 2,
    "confidence": "medium",
    "needs_review": true,
    "review_reason": "special_type not confirmed; visual review needed"
  },
  {
    "id": "seviper_unknown_unknown_v1",
    "card_name": "Seviper",
    "quantity": 2,
    "card_category": "Unknown",
    "pokemon_type": "Unknown",
    "stage": "Unknown",
    "hp": null,
    "is_ex": false,
    "special_type": "unknown",
    "rarity": "unknown",
    "set_or_pack": "unknown",
    "variant_notes": "",
    "source_screenshot": "IMG_1545.PNG",
    "source_row": 1,
    "source_column": 3,
    "confidence": "medium",
    "needs_review": true,
    "review_reason": "special_type not confirmed; visual review needed"
  },
  {
    "id": "zorua_unknown_unknown_v1",
    "card_name": "Zorua",
    "quantity": 1,
    "card_category": "Unknown",
    "pokemon_type": "Unknown",
    "stage": "Unknown",
    "hp": null,
    "is_ex": false,
    "special_type": "unknown",
    "rarity": "unknown",
    "set_or_pack": "unknown",
    "variant_notes": "",
    "source_screenshot": "IMG_1545.PNG",
    "source_row": 2,
    "source_column": 1,
    "confidence": "medium",
    "needs_review": true,
    "review_reason": "special_type not confirmed; visual review needed"
  },
  {
    "id": "vullaby_unknown_unknown_v1",
    "card_name": "Vullaby",
    "quantity": 4,
    "card_category": "Unknown",
    "pokemon_type": "Unknown",
    "stage": "Unknown",
    "hp": null,
    "is_ex": false,
    "special_type": "unknown",
    "rarity": "unknown",
    "set_or_pack": "unknown",
    "variant_notes": "user wrote Villaby",
    "source_screenshot": "IMG_1545.PNG",
    "source_row": 2,
    "source_column": 2,
    "confidence": "medium",
    "needs_review": true,
    "review_reason": "special_type not confirmed; visual review needed"
  },
  {
    "id": "bronzor_unknown_unknown_v1",
    "card_name": "Bronzor",
    "quantity": 1,
    "card_category": "Unknown",
    "pokemon_type": "Unknown",
    "stage": "Unknown",
    "hp": null,
    "is_ex": false,
    "special_type": "unknown",
    "rarity": "unknown",
    "set_or_pack": "unknown",
    "variant_notes": "",
    "source_screenshot": "IMG_1545.PNG",
    "source_row": 2,
    "source_column": 3,
    "confidence": "medium",
    "needs_review": true,
    "review_reason": "special_type not confirmed; visual review needed"
  },
  {
    "id": "chansey_unknown_unknown_v1",
    "card_name": "Chansey",
    "quantity": 1,
    "card_category": "Unknown",
    "pokemon_type": "Unknown",
    "stage": "Unknown",
    "hp": null,
    "is_ex": false,
    "special_type": "unknown",
    "rarity": "unknown",
    "set_or_pack": "unknown",
    "variant_notes": "",
    "source_screenshot": "IMG_1545.PNG",
    "source_row": 3,
    "source_column": 1,
    "confidence": "medium",
    "needs_review": true,
    "review_reason": "special_type not confirmed; visual review needed"
  },
  {
    "id": "castform_unknown_unknown_v1",
    "card_name": "Castform",
    "quantity": 2,
    "card_category": "Unknown",
    "pokemon_type": "Unknown",
    "stage": "Unknown",
    "hp": null,
    "is_ex": false,
    "special_type": "unknown",
    "rarity": "unknown",
    "set_or_pack": "unknown",
    "variant_notes": "",
    "source_screenshot": "IMG_1545.PNG",
    "source_row": 3,
    "source_column": 2,
    "confidence": "medium",
    "needs_review": true,
    "review_reason": "special_type not confirmed; visual review needed"
  },
  {
    "id": "watchog_unknown_unknown_v1",
    "card_name": "Watchog",
    "quantity": 2,
    "card_category": "Unknown",
    "pokemon_type": "Unknown",
    "stage": "Unknown",
    "hp": null,
    "is_ex": false,
    "special_type": "unknown",
    "rarity": "unknown",
    "set_or_pack": "unknown",
    "variant_notes": "",
    "source_screenshot": "IMG_1545.PNG",
    "source_row": 3,
    "source_column": 3,
    "confidence": "medium",
    "needs_review": true,
    "review_reason": "special_type not confirmed; visual review needed"
  }
]