[
  {
    "id": "unknown_img_1539_r1c1_unknown_unknown_v1",
    "card_name": "UNKNOWN_IMG_1539_r1c1",
    "quantity": 0,
    "card_category": "Unknown",
    "pokemon_type": "Unknown",
    "stage": "Unknown",
    "hp": null,
    "is_ex": false,
    "special_type": "unknown",
    "rarity": "unknown",
    "set_or_pack": "unknown",
    "variant_notes": "no_candidate; user_identify_required; is_ex_unverified",
    "source_screenshot": "IMG_1539.PNG",
    "source_row": 1,
    "source_column": 1,
    "confidence": "low",
    "needs_review": true,
    "review_reason": "draft entry; confirm card_name and quantity; card name unknown — identify from contact sheet"
  },
  {
    "id": "unknown_img_1539_r1c2_unknown_unknown_v1",
    "card_name": "UNKNOWN_IMG_1539_r1c2",
    "quantity": 0,
    "card_category": "Unknown",
    "pokemon_type": "Unknown",
    "stage": "Unknown",
    "hp": null,
    "is_ex": false,
    "special_type": "unknown",
    "rarity": "unknown",
    "set_or_pack": "unknown",
    "variant_notes": "no_candidate; user_identify_required; is_ex_unverified",
    "source_screenshot": "IMG_1539.PNG",
    "source_row": 1,
    "source_column": 2,
    "confidence": "low",
    "needs_review": true,
    "review_reason": "draft entry; confirm card_name and quantity; card name unknown — identify from contact sheet"
  },
  {
    "id": "makuhita_unknown_unknown_v1",
    "card_name": "Makuhita",
    "quantity": 0,
    "card_category": "Unknown",
    "pokemon_type": "Unknown",
    "stage": "Unknown",
    "hp": null,
    "is_ex": false,
    "special_type": "unknown",
    "rarity": "unknown",
    "set_or_pack": "unknown",
    "variant_notes": "auto_draft_candidate_score_84; user_verify; ref:stage=Basic; is_ex_unverified",
    "source_screenshot": "IMG_1539.PNG",
    "source_row": 1,
    "source_column": 3,
    "confidence": "low",
    "needs_review": true,
    "review_reason": "draft entry; confirm card_name and quantity; draft candidate (score 84) — verify against contact sheet"
  },
  {
    "id": "nosepass_unknown_unknown_v1",
    "card_name": "Nosepass",
    "quantity": 0,
    "card_category": "Unknown",
    "pokemon_type": "Unknown",
    "stage": "Unknown",
    "hp": null,
    "is_ex": false,
    "special_type": "unknown",
    "rarity": "unknown",
    "set_or_pack": "unknown",
    "variant_notes": "autofill_score_100; user_verify_name_and_quantity; ref:stage=Basic",
    "source_screenshot": "IMG_1539.PNG",
    "source_row": 2,
    "source_column": 1,
    "confidence": "medium",
    "needs_review": true,
    "review_reason": "draft entry; confirm card_name and quantity"
  },
  {
    "id": "unknown_img_1539_r2c2_unknown_unknown_v1",
    "card_name": "UNKNOWN_IMG_1539_r2c2",
    "quantity": 0,
    "card_category": "Unknown",
    "pokemon_type": "Unknown",
    "stage": "Unknown",
    "hp": null,
    "is_ex": false,
    "special_type": "unknown",
    "rarity": "unknown",
    "set_or_pack": "unknown",
    "variant_notes": "no_candidate; user_identify_required; is_ex_unverified",
    "source_screenshot": "IMG_1539.PNG",
    "source_row": 2,
    "source_column": 2,
    "confidence": "low",
    "needs_review": true,
    "review_reason": "draft entry; confirm card_name and quantity; card name unknown — identify from contact sheet"
  },
  {
    "id": "unknown_img_1539_r2c3_unknown_unknown_v1",
    "card_name": "UNKNOWN_IMG_1539_r2c3",
    "quantity": 0,
    "card_category": "Unknown",
    "pokemon_type": "Unknown",
    "stage": "Unknown",
    "hp": null,
    "is_ex": false,
    "special_type": "unknown",
    "rarity": "unknown",
    "set_or_pack": "unknown",
    "variant_notes": "no_candidate; user_identify_required; is_ex_unverified",
    "source_screenshot": "IMG_1539.PNG",
    "source_row": 2,
    "source_column": 3,
    "confidence": "low",
    "needs_review": true,
    "review_reason": "draft entry; confirm card_name and quantity; card name unknown — identify from contact sheet"
  },
  {
    "id": "unknown_img_1539_r3c1_unknown_unknown_v1",
    "card_name": "UNKNOWN_IMG_1539_r3c1",
    "quantity": 0,
    "card_category": "Unknown",
    "pokemon_type": "Unknown",
    "stage": "Unknown",
    "hp": null,
    "is_ex": false,
    "special_type": "unknown",
    "rarity": "unknown",
    "set_or_pack": "unknown",
    "variant_notes": "no_candidate; user_identify_required; is_ex_unverified",
    "source_screenshot": "IMG_1539.PNG",
    "source_row": 3,
    "source_column": 1,
    "confidence": "low",
    "needs_review": true,
    "review_reason": "draft entry; confirm card_name and quantity; card name unknown — identify from contact sheet"
  },
  {
    "id": "unknown_img_1539_r3c2_unknown_unknown_v1",
    "card_name": "UNKNOWN_IMG_1539_r3c2",
    "quantity": 0,
    "card_category": "Unknown",
    "pokemon_type": "Unknown",
    "stage": "Unknown",
    "hp": null,
    "is_ex": false,
    "special_type": "unknown",
    "rarity": "unknown",
    "set_or_pack": "unknown",
    "variant_notes": "no_candidate; user_identify_required; is_ex_unverified",
    "source_screenshot": "IMG_1539.PNG",
    "source_row": 3,
    "source_column": 2,
    "confidence": "low",
    "needs_review": true,
    "review_reason": "draft entry; confirm card_name and quantity; card name unknown — identify from contact sheet"
  },
  {
    "id": "porygon_unknown_unknown_v1",
    "card_name": "Porygon",
    "quantity": 0,
    "card_category": "Unknown",
    "pokemon_type": "Unknown",
    "stage": "Unknown",
    "hp": null,
    "is_ex": false,
    "special_type": "unknown",
    "rarity": "unknown",
    "set_or_pack": "unknown",
    "variant_notes": "auto_draft_candidate_score_82; user_verify; ref:stage=Basic; is_ex_unverified",
    "source_screenshot": "IMG_1539.PNG",
    "source_row": 3,
    "source_column": 3,
    "confidence": "low",
    "needs_review": true,
    "review_reason": "draft entry; confirm card_name and quantity; draft candidate (score 82) — verify against contact sheet"
  }
]