[
  {
    "id": "unknown_img_1540_r1c1_unknown_unknown_v1",
    "card_name": "UNKNOWN_IMG_1540_r1c1",
    "quantity": 0,
    "card_category": "Unknown",
    "pokemon_type": "Unknown",
    "stage": "Unknown",
    "hp": null,
    "is_ex": false,
    "special_type": "unknown",
    "rarity": "unknown",
    "set_or_pack": "unknown",
    "variant_notes": "no_candidate; user_identify_required; is_ex_unverified",
    "source_screenshot": "IMG_1540.PNG",
    "source_row": 1,
    "source_column": 1,
    "confidence": "low",
    "needs_review": true,
    "review_reason": "draft entry; confirm card_name and quantity; card name unknown — identify from contact sheet"
  },
  {
    "id": "unknown_img_1540_r1c2_unknown_unknown_v1",
    "card_name": "UNKNOWN_IMG_1540_r1c2",
    "quantity": 0,
    "card_category": "Unknown",
    "pokemon_type": "Unknown",
    "stage": "Unknown",
    "hp": null,
    "is_ex": false,
    "special_type": "unknown",
    "rarity": "unknown",
    "set_or_pack": "unknown",
    "variant_notes": "no_candidate; user_identify_required; is_ex_unverified",
    "source_screenshot": "IMG_1540.PNG",
    "source_row": 1,
    "source_column": 2,
    "confidence": "low",
    "needs_review": true,
    "review_reason": "draft entry; confirm card_name and quantity; card name unknown — identify from contact sheet"
  },
  {
    "id": "unknown_img_1540_r1c3_unknown_unknown_v1",
    "card_name": "UNKNOWN_IMG_1540_r1c3",
    "quantity": 0,
    "card_category": "Unknown",
    "pokemon_type": "Unknown",
    "stage": "Unknown",
    "hp": null,
    "is_ex": false,
    "special_type": "unknown",
    "rarity": "unknown",
    "set_or_pack": "unknown",
    "variant_notes": "no_candidate; user_identify_required; is_ex_unverified",
    "source_screenshot": "IMG_1540.PNG",
    "source_row": 1,
    "source_column": 3,
    "confidence": "low",
    "needs_review": true,
    "review_reason": "draft entry; confirm card_name and quantity; card name unknown — identify from contact sheet"
  },
  {
    "id": "unknown_img_1540_r2c1_unknown_unknown_v1",
    "card_name": "UNKNOWN_IMG_1540_r2c1",
    "quantity": 0,
    "card_category": "Unknown",
    "pokemon_type": "Unknown",
    "stage": "Unknown",
    "hp": null,
    "is_ex": false,
    "special_type": "unknown",
    "rarity": "unknown",
    "set_or_pack": "unknown",
    "variant_notes": "no_candidate; user_identify_required; is_ex_unverified",
    "source_screenshot": "IMG_1540.PNG",
    "source_row": 2,
    "source_column": 1,
    "confidence": "low",
    "needs_review": true,
    "review_reason": "draft entry; confirm card_name and quantity; card name unknown — identify from contact sheet"
  },
  {
    "id": "unknown_img_1540_r2c2_unknown_unknown_v1",
    "card_name": "UNKNOWN_IMG_1540_r2c2",
    "quantity": 0,
    "card_category": "Unknown",
    "pokemon_type": "Unknown",
    "stage": "Unknown",
    "hp": null,
    "is_ex": false,
    "special_type": "unknown",
    "rarity": "unknown",
    "set_or_pack": "unknown",
    "variant_notes": "no_candidate; user_identify_required; is_ex_unverified",
    "source_screenshot": "IMG_1540.PNG",
    "source_row": 2,
    "source_column": 2,
    "confidence": "low",
    "needs_review": true,
    "review_reason": "draft entry; confirm card_name and quantity; card name unknown — identify from contact sheet"
  },
  {
    "id": "unknown_img_1540_r2c3_unknown_unknown_v1",
    "card_name": "UNKNOWN_IMG_1540_r2c3",
    "quantity": 0,
    "card_category": "Unknown",
    "pokemon_type": "Unknown",
    "stage": "Unknown",
    "hp": null,
    "is_ex": false,
    "special_type": "unknown",
    "rarity": "unknown",
    "set_or_pack": "unknown",
    "variant_notes": "no_candidate; user_identify_required; is_ex_unverified",
    "source_screenshot": "IMG_1540.PNG",
    "source_row": 2,
    "source_column": 3,
    "confidence": "low",
    "needs_review": true,
    "review_reason": "draft entry; confirm card_name and quantity; card name unknown — identify from contact sheet"
  },
  {
    "id": "unknown_img_1540_r3c1_unknown_unknown_v1",
    "card_name": "UNKNOWN_IMG_1540_r3c1",
    "quantity": 0,
    "card_category": "Unknown",
    "pokemon_type": "Unknown",
    "stage": "Unknown",
    "hp": null,
    "is_ex": false,
    "special_type": "unknown",
    "rarity": "unknown",
    "set_or_pack": "unknown",
    "variant_notes": "no_candidate; user_identify_required; is_ex_unverified",
    "source_screenshot": "IMG_1540.PNG",
    "source_row": 3,
    "source_column": 1,
    "confidence": "low",
    "needs_review": true,
    "review_reason": "draft entry; confirm card_name and quantity; card name unknown — identify from contact sheet"
  },
  {
    "id": "unknown_img_1540_r3c2_unknown_unknown_v1",
    "card_name": "UNKNOWN_IMG_1540_r3c2",
    "quantity": 0,
    "card_category": "Unknown",
    "pokemon_type": "Unknown",
    "stage": "Unknown",
    "hp": null,
    "is_ex": false,
    "special_type": "unknown",
    "rarity": "unknown",
    "set_or_pack": "unknown",
    "variant_notes": "no_candidate; user_identify_required; is_ex_unverified",
    "source_screenshot": "IMG_1540.PNG",
    "source_row": 3,
    "source_column": 2,
    "confidence": "low",
    "needs_review": true,
    "review_reason": "draft entry; confirm card_name and quantity; card name unknown — identify from contact sheet"
  },
  {
    "id": "unknown_img_1540_r3c3_unknown_unknown_v1",
    "card_name": "UNKNOWN_IMG_1540_r3c3",
    "quantity": 0,
    "card_category": "Unknown",
    "pokemon_type": "Unknown",
    "stage": "Unknown",
    "hp": null,
    "is_ex": false,
    "special_type": "unknown",
    "rarity": "unknown",
    "set_or_pack": "unknown",
    "variant_notes": "no_candidate; user_identify_required; is_ex_unverified",
    "source_screenshot": "IMG_1540.PNG",
    "source_row": 3,
    "source_column": 3,
    "confidence": "low",
    "needs_review": true,
    "review_reason": "draft entry; confirm card_name and quantity; card name unknown — identify from contact sheet"
  }
]